title,genres,Plot
Nai Nabhannu La 2,"Drama,  Action,  Family,","Nai Navannu la 2 is about a beautiful story of an unpredictable life, emotions, love and dreams presented through the cute love story of two young kids – a boy and a girl studying in the 3rd Standard with heart touching and melodious songs. The movie is a sequel of the romantic hit movie “Nai Na Vannu La” a Direction by Bikash Acharya. The movie is all about the innocence and the cuteness of the love story of the two kids – Shisir and Ritu played by Anubhav Regmi and Sugyani Bhattarai respectively. Shisir has a dream of becoming a sensational singer and musician like Narayan Gopal. The roles of the parents of the boy are played by Suraj Singh Thakuri and Priyanka Karki. Suraj plays the role of a renowned heart surgeon in the movie. The movie starts off showing a scene where a teenage girl is shown getting in a taxi at the Tribhuwan International Airport of Nepal and her destination is the house of Suraj Singh. After a few conversations, the character of Suraj Singh starts relating the"
Bhauju,"Drama,  Social,",
Chapali Height 3,"Thriller,",It’s the third sequel of Nepali thriller movie.
Purano Bullet,"Drama,  Romance,","The film displays ups and downs in the life of ‘Bullet Raja’. According to the press statement issued by production team the film is an amalgamation of action, love, romance and comedy."
Bir Bikram 2,"Comedy,  Love Story,","Bir-Bikram 2 is a Nepali romantic love story movie starring Paul shah, Barsha Shiwakoti, Najir Hussein and Buddi Tamang in key roles. This tale is about the journey of their friendship, love and their roller coaster life."
Jeevan Kanda Ki Phool,"Social,",Jiwan Kada Ki Phool is a book and Madan Puraskar winner written by Jhamak Ghimire about her own story. It has been printed seven times within two years making it the Nepali best seller of all time. It has also received many other awards.
Meri Mamu,"Drama,","Meri Mamu is a Family drama movie directed by Yam Thapa , starring Ayub Sen, Saruk Tamrakar& Aaslesha Thakuri."
Prem Pinda,"History,  Romantic,",Prem Pinda is a historical love story based on a real life of General Aidwin during Rana regime.
Pal,"Drama,","Moments of Life, Pal by Karna Shakya, tells the story in two different perspectives before and after interval. It won the Chalchitra Bikash Parishad award in 2012."
Bhai-Bhai,"Romance,  Action,",Bhai Bhai is Nepali movie directed by Deepak Shrestha.
Encounter,"Action,  Thriller,  Crime,",
Dobato,"Drama,","Dobato is a old nepali movie directed by Dayaram Dahal, an film stars are Rajesh Hamal, Rekha Thapa and others."
Love Station,"Drama,  Romance,","Love Station is a 2019 Nepalese drama romance film directed by Ujwal Ghimire. The film is produced by Gobinda Shahi, Krishu Shahi, and Kabir Bikram Shahi under the banner of Kafiya Films."
Panche Baja,"Drama,",An a actor has a romance over someone's wife while he is in foreign country.
Hawaldar Suntali,"Drama,  Musical,  Reality,",The movie made on real story of police officer Suntali Dhami and is produced by  Chhabi Raj Ojha.
Damini,"Drama,","Damini is an old nepali movie directed by Sanu Shakya.
Its a Bhojpuri Dubbed Nepali Movie ‘Damini’ Conceived by Dr. Sunil Kumar."
Aakashe Kheti,"Drama,  Action,","Aakashe Kheti is new Nepali movie, directed by Uday Subba, and the film stars are Gaurav Pahari, Wilson Vikram Rai, Buddhi Tamang, Neeta Dhungana, Ravindra Jha, Rama Limbu, Jayanand Lama and Shishir Vandel. This movie is based on the story of dreams of young people who want to earn money without any hard work."
Savadhan,,
Sali Kasko Bhena Ko,"Drama,  Social,","Sali Kasko Bhenako is an alternate romantic comedy from the makers of the 1984 hit, 'Kaanchi'. Set in a village nestled in the lap of the Himalayas, the film follows the lives of three individuals in a fun-filled tale of love, relationships, tradition and family."
Hari,"Drama,","Hari is Nepali Movie directed by Pratik Gurung and Safal K.C., starring Bipin Karki, Kamal Mani Nepal, etc.. The movie follows a thirty-year old overly religious and superstitious man-child named Hari. He had led his life whole following the rules that were set by his ancestors and his strict mother."
Chachahui,"Comedy,  Drama,  Romance,  Social,","Two unfortunate idiots Prem (Aryan Sigdel) and Bhola (Bholaraj Sapkota) returns homeland Nepal, in search of Prem's father with a book that they got as a gift from Shyamlal (Maotse Gurung) in HongKong, until they gets entangled in a web of goons and mafia who are obsessed on getting that book."
Kohi Ta Chha,,
Dhamaka,"Romance,  Action,",Dhamaka is Nepali movie directed by Deepak Parikoti.
Maiti,"Drama,  Romance,",
Diarry,,"Diary is a movie filled with love and action. A girl (Joya) who is a radio jockey believes god has a plan for everyone that they will meet their true soulmate at some point of life. She eventually finds a handsome boy named Swapnil who propose her while they are sitting in a couple bench of a park. After both are in relationship, a villein character role played by Rekha Thapa is introduced in Swapnil’s life. Rekha tries to eradicate him from the relationship with Joya while he tries to fight for his love. Will he be able to win the vicious battle or will he lose?"
How Funny,"Comedy,",
Chha Ekan Chha,"Comedy,","A rich bachelorette is disgusted when she realizes her six suitors are full of lies, deceit and empty promises."
Taandro,"Drama,  Action,","This story explores the inner world of a rebel who belongs to an ultra-leftist underground outfit that is battling the government forces. Seriously injured during an ambush, he hides out in a village, his fate dependent on the mercy of the villagers. They believe he is to blame for the death of the innocent native girl killed during the ambush. Left alone with his disturbing thoughts, he will have to dependent on the kindness of strangers, loyalty of his comrades and sheer will power to survive."
Chauka Dau,"Comedy,  Drama,","Movie is based on the assumption that men, regardless of their age and marital status, are sexually attracted to women. Of course, the assumption has theoretical foundations in the works of Freud and others. However, four people living in the same neighbourhood and desperately following a single woman from morning to evening and the lady tactfully maintaining an intimate relationship with each of them is not more than a farce."
Johnny Gentleman,"Romance,  Action,","The story of movie is focused on character Johnny and his ups and downs and eventually became Gentleman. This movie has action , comedy as well as love story."
Aafnopan,"Drama,  Romance,",
Dakshina,"Drama,  Romance,",A story about the life of a teacher who always preaches his students to be a good person in life.
Dagbatti,"Romance,  Social,",
Parkhi Base,"Other,",Parkhi Base is Nepali movie directed by Deepak Shrestha.
Ujeli : A Child Bride in Nepal,"Drama,  Social,","Ujeli: A child bride in Nepal is a social tragic drama depecting child marriage culture in Nepal. This film underlines the sharp distinctions between the roles of boys and girls in Nepal such as education, food and medical care. The film is directed by Deependra Gauchan and produced by UNICEF."
Lappan Chhappan 2,"Action,",Lappan Chhappan 2 is new nepali movie directed by Mukunda Bhatta.
Sano Sansar,"Romantic,",Ravi and Reetu are good chat friends but they have got no idea that they hate each other in the real life situation.
Aafno Birano,"Social,  Action,",Aafno Birano is Nepali movie directed by Mukunda Shrestha.
Darpan Chhaya 2,"Drama,  Social,  Love Story,","Directed by Tulsi Ghimire, Darpan Chaya 2 is the second part, but not a sequel, of the blockbuster movie Darpan Chaya (2001). With the concept of musical love story, the movie stars Puspa Khadka, Sahara Karki and Shraddha Parsai in the lead roles. The story tells a romantic love between a couple who enjoys each other company but, life has something else planned for them."
Mantra,"Drama,  Romance,  Social,",A Himalayan Love Story.
Shasan,"Drama,",Shasan is a nepali movie directed by
14 Peaks: Nothing Is Impossible,"Adventure,  Documentary,  Sport,","14 Peaks: Nothing Is Impossible is about a fearless Nepali mountaineer Nimsdai Purja embarks on a seemingly impossible quest to summit all 14 of the world's 8,000-meter peaks in seven months."
Prasad,"Drama,  Romance,",Prasad is a Nepali social drama about two newlywed couples struggling to conceive a baby. The film portrays how lower class people are intimidated by powerful people and the wife's fight to raise a baby born because of accidental sexual intercourse.
Army,"Drama,  Social,  Action,",
Yug Dekhi Yug Samma,"Drama,  Social,","Yug Dekhi Yug Samma is a 1988 Nepalese film directed by Deepak Rayamajhi and starring Rajesh Hamal, and Kristi. This is Hamal's first Nepali movie as a lead actor."
Radhe,"Romance,  Action,  Thriller,",Radhe is about a man named Radhe who loves Priya but one day he leaves the village without anyone's notice than he joins the Nepalese army to fight for his country.
Black,"Drama,  Crime,",Aavash ( Aakash Shrestha) is a lonely guy desperately looking for a company . The then he meets Shruti ( Aanchal Sharma) a girl of his dream at Bar and from the very moment he expresses his feelings for her. She resists first but when Shruti sees a genuiness behind his attempt she also falls for him. But their journey of love is not easy as they have considered.
Aishwarya,"Drama,  Romance,  Thriller,","Sameer ( Ramesh Upreti) and Raghav ( Prashant Tamrakar) are two rival businessman based in Kathmandu who can go any length to one up each other. But when Deepika (Deepika Prasain), an aspiring fashion model, enters the picture, Sameer and Raghav's rivalry takes a bitter turn and their professional hatred becomes a personal vendetta."
Teen Ghumti,"Drama,  Biography,","Based on a novel ""Teen Ghumti"" by Bishweshwar Prasad Koirala. Indira, a girl from the ethnic group of Newars, falls in love with Pritambar, who is a Brahmin. She marries him, defying her parents. Pritambar has strong morals but lacks any sense of romance. He is involved with a group of revolutionaries who are planning protests against the autocratic rule. This group regularly meets at Pritambar's house and the members get to know Indira. When the security forces crack down on the revolutionary movement, Pritambar is imprisoned. Another member of the group, Roshan, comes to Indira's aid. He starts living with her and soon falls in love. Though she rejects his advances in the beginning, she eventually gives in. Their taboo relationship leads to Indira's pregnancy. With Pritambar due to be released, Indira is faced with a dilemma in her conservative society."
Dukha,"Drama,","The movie ‘Dukha’ is a presentation of Bala Gurung for World One movies. Guest artists in the movie include Suraj Subba, Uttam KC, Gopal Bhutani, Ram Chandra Adhikari and Jayanada Chand. The choreography in the movie is Alaka Shrestha and Kamal Rai. NB Maharjan is the action director and Raju Thapa is the cinematographer of the movie. The movie is written by Suraj Subba ‘Nalbo’ and music is composed by Sambhujit Thapa. The editor is Tara Thapa ‘Kimve’. The story and lyrics of the movie is written by the director Deepak himself."
Lahure,"Drama,  Action,","Lahure is based on the story of the brave Gorkha soldiers and the sacrifices made by them and their families. Starring Shrawan Ghimire, Pradip Pakhrin, Tripti"
Shiva Shakti,,
Jay Shambhu,"Drama,  Romance,  Action,",Action packed love story movie revolves around contemporary society.
Duniya,"Drama,  Social,",
Dui Rupaiya,"Drama,  Action,","One day, while conducting such smuggling, they lose the transaction slip - a Rs. 2 note. The film ""Dui Rupaiyan"" entails their quest to find that Rs. 2 and save their necks, all the while saving themselves from local thugs, police, and their boss too."
Mero Euta Sathi Chha,"Drama,  Romance,","Jay is too spoiled to inherit his grandfather's vast wealth. When he fails to graduate from college, his grandfather's will sends him back to his ancestral village where, long ago, he made a friend. Shikha, Jay's estranged childhood friend, helps Jay rediscover his humanity. But, Shikha is very sick. She shared her dreams with Jay - to rebuild the orphanage where she lives. Jay realizes that this life where he can choose nothing, where money buys nothing important, is dearer to him than a full of privilege. Can he save Shikha and marry her? Will their dream come true? Will Jay re-inherit his ancestral wealth?"
Sathi Ma Timro,"Other,","Saathi Ma Timro is a Nepali movie directed by actor Bhuwan KC which depicts the story of a struggling producer and his son. The movie also touches the sensitive issue of father-son relationship. The character of the son, as a child is played by child artist Shirshak Sapkota."
Mela,"Romance,","This movie revolves around the college life of three best friends Abhishek (Amesh), Priti (Ashishma) and Dipesh (Salon). It is a love story with a bit of comedy, action and drama in it."
Ma Yesto Geet Gauchu,"Romance,","Ma yesto geet gaauchu is a Nepali Musical Love Story film directed by Sudarshan Thapa. Starring Pooja Sharma and Paul Shah in the Lead roles, it was produced by Sudarshan Thapa and Pooja Sharma under the Sudarshan Thapa Production banner. MYGG is a love story centering on the relationship between Paul and Chhaya."
Fateko Jutta,"Comedy,  Drama,","Fateko Jutta is 2017 drama and Comedy film directed by Naresh Khadka and produced by Arjun Kumar. The film stars Saugat Malla, Priyanka Karki, Kameshwor Chaurasiya and Rabindra Jha in lead roles. The film is scheduled to release on 03 November 2017."
Bhool Bhulaiyaa,"Other,",
Bardaan (Short Movie),"Drama,",Bardaan is new nepali short movie directed by Dipendra Lama.
Rudrapriya,"Drama,  Romance,  Action,  Thriller,","Rudra Priya is Nepali movie by the legend actor and actress Aryan Sigdel and Rekha Thapa. After a long time span both of them are seen together. The movie is directed by Sudeep Bhupal Singh and produced by Ramesh MK Poudel as an executive producer. Rudra Priya movie is made under the banner of Rekha Films. The movie stars Rekha Thapa, Aryan Sigdel, Rajan Ishan in the lead roles. Rudra Priya is shot by the cinematographer Sanjay Lama, music composed by Suresh Adhikari, Arjun Pokharel and Rajan Ishan."
Maaleekaa,"Drama,  Social,","Maaleekaa marks a rare feat for a Nepali movie actress, for the film is directed by Thapa and features the actress in a leading role as well. Thapa is seen playing mentor to a girl while she is also featured in a couple of action sequences."
Truck Driver,"Romance,  Social,","Truck Driver is 1994 Romance/Drama Nepalese movie, written by Brazesh Khanal is directed by Rajkumar Sharma. This movie features Shiv Shrestha, Karishma Manandhar, Shree Krishna Shrestha, Madan Krishna Shrestha and Hari Bansha Acharya in the lead role."
Sunpani,"Drama,  Social,",
Jhumkee,"Thriller,",Jhumkee features suspense story on Women Violence in Nepal.
Ek Number Ko Pakhe,"Other,","Ek Number Ko Pakhe is a 1999 Nepali film directed by Kishor Rana Magar. The film stars Rajesh Hamal and Karishma Manandhar in lead roles with an ensemble of supporting cast including Ramesh Upreti, Jal Shah, Neer Shah, Basundhara Bhusal, Ravi Shah and Dinesh DC."
Kohalpur Express,"Comedy,  Drama,","Kohalpur Express is a story about three women who try their luck with the same. What follows is a series of comical events, misfortunes and coincidences that only adds more misery to their already troubled lives.
The movie is directed by Bishal Bhandari starring, Priyanka Karki, Reecha Sharma, Keki Adhikari, Binod Neupane, Buddhi Tamang."
Loafer,"Thriller,  Suspense,",Loafer is a suspense thriller Nepali film based on the story of unemployed people.
Pandit Bajeko Lauri,"Drama,  Social,",Pandit baje's lauri is struggle of Kashiram pandit to finish pandityai of his brother Sitaram pandit who is doing pandityai and hiding bad relation with cowardly woman in a village.
Hijo Aaja Ka Kura,"Comedy,  Drama,",
Love Diaries,"Comedy,  Romance,",A romantic comedy movie.
Nepathya,"Comedy,  Drama,  Romance,",Story of a men to be a movie star.
Bishwas,"Drama,  Romance,",Bishwas is superhit old Nepali movie directed by Ujwal Ghimire.
Hero No.1,"Comedy,  Action,","Hero No. 1' directed by Jay Kishan Basnet has also released today. It includes Jay Kishan Basnet, Elina Rayamajhi, Jahanvi Basnet, Sanghrat Maharjan, Sobhit Basnet, Laya Sangraula, Tarzaan, etc. as major casts."
Dimaag Kharaab,"Comedy,  Drama,  Action,","Dimag Kharab is a 2023 Nepali film, which is directed by Nischal Basnet from a screenplay by Aakash Baral under the banner of Black Horse Pictures Pvt.Ltd. It is produced by Raunak Bikram Kandel."
Sushree Sampati,"Comedy,  Romance,  Family,",Social comedy Nepali film based on two slum dwellers in Pokhara in search of a rich girl to get married and get settled in life influenced by their fellow mates.
The Break Up,"Comedy,  Drama,  Romance,",Love story between Aaviskhar and Sara and how their friends-with-benefits relationship ends up in them falling in love with each other.
Bhai,"Drama,  Social,",Bhai is a Nepali movie directed by Deepak Shrestha.
Lalpurja,"Drama,  Romance,","Lalpurja is a story of struggle between two brothers for a piece of land.It is set in Miteri Gaon,an imaginary village of Nepal."
Kafal Pakyo,"Drama,  Romance,",When a guy get a marriage date but while going to the location he encounters many weird stuff.
Ramkahani,"Comedy,  Romance,  Horror,",An adult returns from Qatar to Nepal in maintaining his love life.
Rajja Rani,"Drama,","In the Terai region of Nepal, Raja struggles for his love of Rani and the social and cultural obstacles that are thrown their way."
Sunkesari,"Horror,","Sunkesari tells the story of an Australian palace constructed around 1880 AD and how it is converted into a boutique hotel, and the strange tale of the supernatural beings that live among the hotel's corridors."
Kaira,"Drama,  Romance,  Social,","Kaira, a romantic movie is an ups and down journey of love where the protagonists Jay and Kaira, are lucky for everything but unlucky for love. This Journey of love makes its destination to Philippines where Jay has adapted himself to the different world with the hope that he won’t be meeting Kaira but gets surprised when he meets Kaira and twist of their love story in the Philippines and the rest of the story continues in Philippines itself unfolding their love with twists and turns."
Himmatwali,"Action,  Adventure,","Nepali movie ‘Himmatwali’ is a presentation of actress Rekha Thapa under her home production banner Rekha Films and her directorial debut. ‘Himmatwali’ introduced disabled actor Sudarshan Gautam for the first time in Nepali films. Sudarshan, a Canadian citizen without hands has made world records by climbing Mt. Everest and other unbelievable feats. He can also do his day to day things with his feet and can even drive cars with his feet. In addition to romancing in the movie, Sudarshan and Rekha also romanced in real life. Rekha had been single after divorcing Chhabi Raj Ojha and Sudarshan had also divorced his wife. In various interviews, they hadn’t denied the possibility of marriage between the two."
Sadak,"Drama,  Romance,  Action,",
Jatra,"Comedy,  Drama,  Action,","An innocent, poor and hardworking man Phadindra Timsina (Bipin Karki) finds a sack full of 3 Crores Nepalese rupees stolen from a bank. He then consults with his 2 friends Jayas (Rabindra Singh Baniya) and Munna (Rabindra Jha) to make that money white."
Mero Paisa Khoi,"Comedy,  Drama,","Mero Paisa Khoi' is a comedy movie, directed by Rose Rana and produced by Uma KC."
Awara,"Comedy,  Action,","""AAWARA"" is a Social Drama ,with comedy,Action. Presented by Taiyab Shah is story & screenply by Prakash Thapa, directed by Vijay Thapa. The star cast includes Rajesh Hamal, Puja Chand, Harihar Sharma, Basundhara Bhushal, Shanti Maskey, Sushila Rayamajhi, Deepashri Niraula, Srisha Karki, Ramesh Budhathoki, Pawan Mainali, Prakash Thapa and others."
The Most Wanted,,
K Yo Maya Ho,"Romantic,","It is the second direction of Sudarshan Thapa after the superhit movie Mero Euta Saathi Chha. The story of this movie is based on trending western culture in Nepal i.e Living Together. It contains the problems and life of youngsters in the cities. Audience will be entertained by some comics and good music, directed by Sugam Pokhrel."
First Love,"Romantic,","""First Love"" is the love story roaming between three close friends two girls."
Jholay,"Comedy,",Satire/Dark Comedy based on True Events.
Kirtipur - The Legend of Kirtilaxmi,"History,","Kirtipur The Legend of Kirtilaxmi, is a 2019 nepali movie directed by Pradeep Khadgi. It portrays the Historical event of the epic battle between Gorkha and Kirtipur held on about 250 years ago."
Agni Pariksha,"Drama,  Social,",
Dui Kinara,"Drama,  Social,",
Children of the Snow Land,,"""CHILDREN OF THE SNOW LAND tells the story of a group of children born in the High Himalayas of Nepal — a remote area of great natural beauty but where life is extremely tough. From just four years old, some children are sent by their parents to the capital city, Kathmandu, to a school run by a Buddhist monk in the hope that education will give them a better chance in life. For ten years or more, they do not see or speak to their parents, due to the remoteness of their villages. Now, upon graduation, aged 16, the children are making the trek home: an arduous and lengthy journey across mountains that takes them to the highest inhabited place on the planet; a faraway, off-grid land where the way of life has not changed for thousands of years, and where their parents are waiting to see children brought up in a world of mobile phones, social media and most modern conveniences. And then the earthquake strikes."
Ngolo Thagu (Thulo Solti),"Drama,  Social,",Ngolo Thagu (Thulo Solti) is a Nepali Gurung movie directed by Janak Gurung.
Saayad 2,"Romance,  Action,","The film stars Sushil Shrestha and Sharon Shrestha in lead roles. It also features Amrit Dhungana, Kushal Pandey, Sunil Rawal, Sushil Sitaula, Nisha Karki, Rubina Shrestha, and Buddhi Lal Magar. The film initially cast Sandhya K.C, Arpana Upadhyaya and Aashirman Joshi in lead roles but they were replaced by Sharon, Nisha Karki and Kushal Pandey respectively."
Dhanapati,"Comedy,  Drama,","Dhanapati, a poor man suffering from high poverty is pulled towards politics after not able pay for his daughter school to earn lot of money he goes into politics to earn money."
Saraswati,"Drama,",
Butterfly,"Drama,  Romance,","Butterfly (colors of love) is a movie replete with thriller, suspense, adventure and comedy. marked as is with extraordinary lucidity, the movie elegantly compares the shades of love with the exquisite colors of butterfly."
Mr. Nepali,,
Love You Hamesha,"Drama,  Romance,","Love You Hamesha is a Nepali movie released on 1 Nov, 2019. The movie is directed by Bhaskar Pradhan and featured Yash Raj Garuch, Fiza Yonjan, Richa Thapa and Shisir Rana as lead characters."
Agastya,"Drama,  Action,","""The unbreakable AGASTYA - Chapter 1"" is new Nepali movie directed by Saurav Chaudhary and includes stars from Nepali film industry as well as bollywood with the filming at beautiful places Gorakhpur, Banaras, Kathmandu and Nawalparashi. They will reveal their star cast very soon & are going to be one of the biggest projects of Nepali film industry."
Maya Ko Barima,"Drama,  Romance,",
Lappan Chhappan,"Drama,  Crime,","Lappan Chhappan, is a Nepali gangster film directed by Mukunda Bhatta and produced by Damber Bahadur Chand.
The character named Banka sets out to take revenge on the minister who betrayed him."
Mukhauta,"Action,  Crime,",Mukhauta is a Nepali movie which features gangster life in thamel how the two gangs use their power against other people.
Kagbeni,"Drama,  Horror,","Old friends Krishna and Ramesh meet after ages and on their way to home, an old hermit gives them ""a monkey's paw"" that has the power to grant wishes. And, from then onward, the paw changes everyone's life."
Furke,"Comedy,  Drama,",
Changa,"Comedy,","Story of three guys, who are planning to earn money from fast and easy way. While a boy of wealthy family is missing they are planning with puzzle of kidnapping. The mixed up of mystery, revolving and twist of life is the movie CHANGA."
Karkhana,"Romance,",Karkhana is a romantic drama with a strong social message.it is a story about a women's wrong choice in life and the difficulties she faces to come to terms with and to overcome these challenges.
Bhrasta Nayak,"Social,",Social Movie
Sapana Timro Mero,"Romance,  Social,",
Parva,"Romance,  Social,","Parva is a psychological thriller which carries a story about a character, who continuously carries out attacks for his self satisfaction, after an incident occurred at a festival."
Lalteen,"Drama,  Action,",Lalteen is a movie that illustrates the criminal activities of gangs and their way of life in the city. Guns and violence are daily rituals of gang members and innocent people are victimised. Lalteen visualises the hardship when involved with criminals and the result is mostly terrible.
Silsila,"Drama,",When a journalist nearly get killed from his enemy his mother and other people do everything to revive him up.
Tandav,"Thriller,  Crime,","Three child-laborers brought together by circumstances – Amrit, Maya, and Amir – grew up together and learned to look after each other. But Ganesh, a weapons smuggler, destroyed their lives by forcing Amrit into working for him, and Maya a prostitute. Only Amir escaped that hell."
,"Other,",
Malati Ko Bhatti,"Rated X,",
Euta Saathi,"Romantic,",Euta Saathi is a Nepali movie directed by Laxman Subedi.
Jwala,"Drama,  Romance,  Social,",Rajesh Hamal is a hero in this movie.
