title,genres,Plot
Ke Ghar Ke Dera - Ghar No. 2,,"The film tells the story of people from different backgrounds who are all struggling during a tough financial crisis. As their money problems grow, they begin to question their purpose and lose trust in the government, which seems unable to help. Their relationships suffer, some face betrayal over money, while others deal with family problems and growing mental stress. The film shows how financial issues affect not just daily life, but also people's emotions, families, and hopes for the future. The story holding relevance for everyone !!!!!"
Sinner,Thriller,"Sinner, a troubled man, hosts a party where his closest “friends” gather around a dining table. As the night unfolds, their conversations turn accusatory—each one confronting him with unforgivable mistakes from his past. But these companions are not friends at all; they are the living embodiments of his sins, drawn from Hindu scriptures: Abhimaan (Pride), Irsha (Jealousy), Trishna (Desire), Kama (Lust), and Aakrosh (Anger). One by one, the sins expose his guilt, contradictions, and failures, each story clashing with the other. As the voices grow louder and the night spirals into chaos, Sinner’s grip on reality fractures. What begins as a gathering becomes a hallucinatory trial of his own soul, forcing him to face the demons within that he can no longer suppress."
Naina Resham,"Drama, Romance","An ill-fated romance is tested by betrayal, family conflicts, and ruthless enemies as two lovers fight against overwhelming odds to protect their love and future together."
Hari Bahadur Ko Jutta,"Drama, Comedy","Hari Bahadur Ko Jutta is a social comedy directed by Dipendra K. Khanal, starring Hari Bansha Acharya as the iconic Hari Bahadur. The film follows a humorous yet heartfelt journey that highlights class differences, social struggles, and human resilience."
Sapana,"Romance, Drama","A story follows a girl named Sapana, who dreams of marrying a man just like the one she has always imagined. However, she is completely unaware that the one truly meant for her has been by her side all along."
Chameli Ko Poi,Drama,Plot to be announced.
Jatra,"Comedy, Drama","An innocent, poor and hardworking man Phadindra Timsina finds a sack full of 3 Crores Nepalese rupees stolen from a bank. He then consults with his 2 friends Jayas and Munna to turn that money white."
Saino,Drama,Saino is a 2019 Nepali drama film directed by Ramesh Thapa and produced by veteran Nepali actress Bhuwan Chand.
Degree Maila: M.A. 3rd Class,"Drama, Comedy","Degree Maaila is the only English graduate in a village, who has returned from a city. As the campus committee is warned to run the English classes properly or bear the consequences of shutting down, they decide to hire him for the job, which he declines. Maaila's love interest and the committee want him to take up the job but he is adamant."
Malati Mangale,Drama,"Malati and Mangales navigate love, sacrifice, and life's harsh realities, where emotions clash with responsibilities, revealing the fragile yet enduring bond that keeps them together through pain and change."
Prakash,Drama,"An educated young boy from remote Nepal who dreams of becoming a teacher in a government school, the story of his struggle to fulfill his dream amidst economic hardships."
Balidaan,History,"Balidaan (Sacrifice) is a 1997 Nepali historical drama film set in Panchayat-era Nepal, and depicts a fictionalised version of the contemporary democracy movement."
Bhagya Bidhata,Drama,"Directed by Dayaram Dahal, the 2007 Nepali action-drama Bhagya Bidhata follows two contrasting protagonists— played by megastars Rajesh Hamal and Nikhil Upreti— who find their lives intertwined in a story of duty, justice, and destiny."
Chhakka Panja 3,"Comedy, Drama","The headmaster's daughter returns to her rural village to reform a corrupt, mismanaged government school, facing fierce resistance from local politicians and her own in-laws in the process."
Nai Nabhannu La 6,Romance,"The story centers on Shishir, a skilled cinema actor, and his deep, emotional bond with his young daughter, Ditya. It explores themes of single fatherhood, family secrets, love, and emotional loss."
Khel,Horror,"Years after a tragic incident with a cursed Ouija game, three friends return to their abandoned dormitory to confront their haunted past and unravel a deadly Nepalese folklore curse."
Dobato,Drama,"Dobato is a classic Nepali movie released in 2007, celebrated for bringing together some of the biggest icons of the Nepali film industry."
Taraharu,Drama,"Mohan is an honest Transport company worker living with his wife Maiya. Their peaceful life is disrupted by Ratan, a powerful and immoral transport company manager who becomes obsessed with Maiya. Using Mohan’s financial struggles to his advantage, Ratan pressures him and eventually gets him fired. Despite facing betrayal, theft, and police trouble, Mohan sinks into depression and nearly gives up on life. With the support of Jyami an occasionally made friend and band owner, other friends, and his passion for music, he regains hope. In the end, Mohan succeeds in opening his café. Ratan’s crimes are exposed, and the story concludes with the message that life is worth living."
Satidevi,,"Kul Bahadur, a poor villager battling alcoholism, has four daughters. Though he wishes for a son, his eldest daughter, Sati Devi, strives to make him happy. However, their lives are marred by heart-wrenching events."
Password,,
Aago,Drama,"An editor-in-chief and his nephew expose the corruption of political leaders, facing grave danger when the reporter falls in love with the daughter of a corrupt politician."
Dimag Kharab,"Drama, Comedy","When bureaucratic barriers obstruct Indra Sharma's desire to work overseas, his dreams of a stable family life take a turbulent turn."
Nai Nabhannu La 2,,The emotional journey of a cancer-stricken young boy who learns to sing and play a musical instrument to impress a young girl.
Xira,"Action, Crime","Martial arts, Xira embarks on a relentless path of vengeance and justice after a notorious mob kingpin murders her police officer husband."
Kagbeni,"Horror, Drama","Kagbeni transplants the famous horror story, The Monkey's Paw, to the mountains of Nepal. Krishna has returned to his village, Kagben from Malaysia, and is reminiscing with his old friend Ramesh. They come upon an old hermit, who presents them with a cursed monkey's paw that has the power both to grant wishes, and twist their meaning to cause tragedies."
Six Strands,"Drama, Mystery","Partially based on true stories, 'Six Strands' is a character study inspired by the world famous Darjeeling tea industry and its undisclosed secrets."
Ghumto,Drama,"A romantic drama that revolves around intertwined love triangles, complex relationships, and emotional struggles, following the lives of its central characters played by  Dilip Rayamajhi, Jal Shah, Ramesh Upreti, and Melina Manandhar."
Anjila,Drama,"The movie ""Anjila"" is based on the real-life story of Anjila Tumbapo Subba, the captain and number one goalkeeper of Nepal's national women's football team. The film showcases her journey from being confined within her home to becoming the team captain, highlighting her struggles and determination .Anjila herself plays the lead role, with Dayahang Rai and Srijana Subba portraying her parents The movie emphasizes the importance of perseverance and the belief that with determination, nothing is impossible."
Baa: Ek Yoddha,"Drama, Family",Plot to be announced.
2.0 Chhadke,"Action, Comedy, Crime","Family of Mendog is killed by Gangsters of Manang while collecting Yarsagumba, but he lives to plot his vengence."
Kumari,Romance,"A tender romantic drama about two young hearts brought together by fate. Kumari explores love, emotions, and the courage to choose the heart despite life’s challenges. A soulful Valentine-season love story."
Savitri,,"A typist, dissatisfied with her marriage, dreams of office romance."
A Mero Hajur,"Drama, Romance",Shraddha is deceived by her relatives for her wealth and is left with the one person she loathes most in the world.
Darpan Chhaya,"Drama, Romance",Two friends involve with same girl which eventually deteriorating their friendship.
Kushti,"Romance, Comedy","A touching comedy-drama about a wrestling-loving couple torn by clashing personalities. They can't live together, yet can't stay apart. This story is a humorous, emotional journey of love, struggle, and deep connection."
Parbati,Drama,"Autism is not a weakness or a flaw, it is simply a different way of experiencing the world. Every person learns, thinks, feels, communicates, and understands life in their own unique way. This story follows the emotional journey of a brother and sister whose deep bond becomes the heart of the film. Amid society’s misunderstandings and everyday struggles, their relationship reflects love, acceptance, sacrifice, and the strength of family, creating a touching and inspiring tale about embracing individuality."
First Love,"Romance, Drama","Five friends in their college life- trying to navigate through their first love unaware of problems, and conflict they have to share, and compromise they will make."
Saathi,"Drama, Family","A child is separated from his family by evil relatives who want to invade their property. The child is taken care of by a maid, and later, when he grows up, she reveals his backstory to him. As a result, he reunites with his family."
White Sun,Drama,"Young Pooja lives with her mother in a village in Nepal. Though saddened by the death of her grandfather, she is secretly thrilled at the prospect of meeting the man she hopes may be her father — Chandra, a former Maoist guerrilla who is returning home after a decade-long civil conflict."
Rangi,"Drama, Family","Pawan, a father, gets a chance to regain his old life after discovering the unconditional love of his six-year-old daughter, Kavya. Motivated by her love, Pawan embarks on a journey of honesty and hard work, leaving his past life behind. Along the way, he faces many difficulties, but these struggles inspire Kavya to help her father overcome his hardships. Together, Pawan and Kavya begin their own paths toward success, proving the power of love, determination, and family."
Soltini,"Romance, Drama, Family",Chaos arises and Delasha realises about her longingness by his Solti when she asks him- Bhimsen to help her elder sister elope with his childhood friend.
Batulo Jun,"Drama, Romance",Plot to be announced.
Gangster Blues,"Action, Drama, Romance, Thriller",In this corrupted world Youth have a lot of reasons to turn into criminals but when you have someone special you love there will be much more consequences that needs to be faced.Story revolves around two protagonists.
Sambodhan,"Action, Drama","A determined investigative journalist is on a thrilling quest to uncover the truth behind a mysterious murder, reflecting the complex, gritty realities of Nepali society."
Kabaddi 4: The Final Match,"Comedy, Drama","After the events of Kabaddi 3, Kaji no longer seeks love as he suffers from the pain of his previous relationships."
Dakshina,"Drama, Family",A story about the life of a teacher who always preaches his students to be a good person in life.
Muna Madan,Drama,"An epic tragedy, based on Nepal's most famous epic poem. Madan, a lower-class worker, is forced by poverty and mounting debts to go to Lhasa, Tibet, leaving behind his lonely mother and beloved wife, Muna. However, tragedy befalls him on the way home."
Mask of Desire,"Drama, Horror","Dipak and Saraswati live a simple life in Kathmandu. A devoted father and an adoring husband, Dipak works as a security guard, while Saraswati happily tends to traditional housework. Their home is modest, and their two girls are happy. Life would be perfect for the pregnant mother if only she could give her husband a son. Desperate in her desire, on the advice of a stranger, Saraswati prays to a new spirit with miraculous results. When the blessing turns to tragedy, the distraught couple appeals to Gita, a jhangrini or healer, revered as a powerful spirit medium. Gita's own crisis of faith and, perhaps, her stunning beauty, forces all three to a dizzying climax, leaving the lines between secular and spiritual desires eerily blurred."
Resham Filili,Drama,"Two friends, both weathered by bad luck, must finally beat the odds to save their lives."
Pujar Sarki,Drama,"Three individuals unite against societal norms perpetuating caste discrimination, facing challenges in their collective struggle to defy the existing caste-based social order."
Nai Nabhannu La 3,"Romance, Drama","A heartfelt and emotional romantic drama that revolves around a young, precocious child who acts as a cupid, cleverly manipulating and bridging the gap between estranged adults in order to mend broken relationships and orchestrate the ultimate union of his loved ones."
Crawling Crows: Aankha,Drama,A newlywed couples struggle with poverty and hardship in Kathmandu's slum.
Julebi,Romance,"Julebi is a Nepali film directed by Ganeshdev Pandey that intertwines three distinct stories centered around the complexities of sexual psychology and modern relationships. Set in Ratnapark, the film explores the desires and passions of seven interconnected characters, with a particular focus on the experiences of Nepali women. The narrative delves into the lives of a sex worker, portrayed by Suraksha Pant, and other characters navigating strained relationships and unspoken love. 𝐉𝐮𝐥𝐞𝐛𝐢 explores love born of choice and necessity. A tale of hearts entangled in the complexities of life, where love knows no one path.  The story of the movie revolves around the relationships of seven characters, interconnected and revolving like a 𝘑𝘶𝘭𝘦𝘣𝘪 (Nepali Sweet)."
Chandra,Drama,"With his elderly grandfather, seven year old Chandra walks through earthquake-hit Kathmandu to visit his mother and newborn sibling in hospital."
Devi,"Crime, Thriller, Action","An upright journalist sets out on an arduous journey to combat against the treacherous system amid increasing rape cases across the nation. Revelations then on leave her in limbo. Amid all this, brutal murders of suspects creates a storm. Will the truth unfold?"
Hijo Aja Ka Kura,"Comedy, Drama","Three young people decide on choosing to emigrate for better lives, but their families say otherwise."
December Falls,"Drama, Romance","A suspense story of a nurse, who struggles for case and love."
Jalaaki,Drama,Plot to be announced.
Bir Bikram 2,Drama,"Bir-Bikram 2 is a 2019 Nepali Romantic love story movie starring Paul shah, Barsha Shiwakoti, Najir Hussein and Buddi Tamang in key roles and is the second installment/franchise of smashing hit movie Bir-Bikram (2016). This tale is about the journey of their friendship, love and roller coster life."
Jaari,"Romance, Drama, Family","The central characters of Jaari are Namsang and Hangma, a married Limbu couple. After a brief argument with her spouse Namsang, Hangma chooses to leave him by giving back his Yuparung (a sacred coin). She then marries a different man after falling in love with him. The jaari is claimed by Namsang and his family, but Hangma’s family refuses to pay, forcing Hangma into slavery in Namsang’s household until the jaari is paid."
Mero Love Story,,"Two strangers Aavas and Nisha met in the bus trip  from Kathmandu to Pokhara. Both of them share their opinion regarding life and characters. As they arrived their destination, both of them apart from each other promising not to meet next time. But both meet at Nisha’s home where Aavas is helping his best friend Vinay to plan a wedding to be with Nisha. Then both of them get separated again. But after few years both met each other and face the situation where both realizes their love."
Ghampani,"Drama, Romance","Two people from different caste start to fall in love but after their parents not allowing them to stay together, they run away."
Cha Cha Hui,"Comedy, Drama",Two friends find themselves caught in a dangerous pursuit when ruthless goons begin chasing a mysterious book with hidden secrets.
Bhaire,Drama,"Two friends set out on a journey to find their long-lost childhood friend on behalf of his 84-year-old dying father. Along the journey, everyone goes through innumerable highs and lows defining love, struggle, care, conflict, and hope."
Ko Afno,"Drama, Thriller","This is a deeply involving drama depicting the desperation between a poor rural couple and a childless upper class urban couple, whose lives are forever altered when the rich couple buys the ingenuous poor couple's 3-year old son, on the promise of a better life. Son grows up emotionally disturbed and resorts to extreme measures to feel less alone."
Gaatho,,A reclusive painter struggles with bipolar disorder and social phobia as he navigates complex emotional boundaries and inner turmoil.
Kohinoor,"Drama, Romance, Action",A determined man finds himself entangled in the criminal underworld while fighting for love and justice.
Agastya – Chapter 1,"Action, Mystery, Thriller","Saurya is haunted by a difficult past and grapples with his troubled mind. After a year, his brother embarks on a quest to find him. A touching story unfolds as Nisan delves into Saurya's history."
Kabaddi,"Comedy, Drama","Aimless Kaji dreams of marrying village girl Maiya by any means. However, she wants to go to the city seeking higher education. Their lives are thrown into turmoil with the arrival of Bibek, a charming young man from the city."
Gharjwai,"Family, Drama","""Gharjwai"" revolves around the intertwined lives of three main characters: a seasoned farmer, a spirited young woman, and a mysterious stranger. As secrets unravel and emotions collide, the film explores themes of love, sacrifice, and redemption. Amidst breathtaking landscapes and cultural traditions, the characters grapple with their pasts, forging unexpected connections that will forever change their destinies."
Aama,Drama,About the story of a family facing a medical emergency and the bureaucratic apathy of the medical institution.
Naakaa,"Action, Crime, Drama","Goldie, a small time smuggler of Barhabise who is in need of a profiting consignment to recover from his current bankruptcy. He gets an emergency call from a local smuggler and businessman of the area to rescue a Tibetan girl and her transporter illegally from one of the sub-border point to Barhabise."
The Break Up,"Comedy, Drama, Romance",Love story between Aaviskhar and Sara and how their friends-with-benefits relationship ends up in them falling in love with each other.
Ghanchakkar,"Comedy, Drama",Ghanchakkar is a Nepali movie about two young people trying to earn the wrong way.
Shree Bukuro : The Home Calling,"Drama, Family","A heartfelt family drama about returning to ancestral village and rediscovering the meaning of home through reconnection with family and the mountains, the story shows how embracing one’s roots can heal relationships and bring true clarity in life."
Mummy,Horror,"After the tragic loss of their beloved family dog, a daughter adopts a mysterious black cat, unwittingly inviting dark forces that threaten to tear her family apart."
Kumbh,"Action, Crime",The high-stakes Nepali action-thriller that follows a gritty protagonist named Raghu as he asserts his dominance and confronts enemies in a world defined by conflict and power struggles
Shambhala,Drama,"In a Himalayan polyandrous village in Nepal, newly married and pregnant Pema tries to make the best of her new life. But soon, her first husband Tashi vanishes on the trade route to Lhasa.  Accompanied by her monk de facto husband, Karma, she embarks on a journey into the unforgiving wilderness to find him, evolving into a quest of self discovery and liberation."
Desan,Drama,"Desan is a Nepali feature film based on the story of a social epidemic, it portrays family love, trust, betrayal and revenge."
Harry Ki Pyari,Romance,"Harry and his 'Pyaari' Jenny, are chasing similar goals in life, but the extent to which they both go about to achieve this is unimaginable."
Jerryy,Romance,"Jerryy is the story about a cool, handsome and rich guy, Jaiveer Rana or Jerryy, who believes “Love is like a Chinese mobile with no guarantee” and his trip to Mustang where he truly falls in love with a beautiful girl, Aakansha and everything after is romance and heartbreaks."
Nametine Ghau,"Action, Drama","The film “Nametine Ghau” is based on the stories of acid attack victims. It sheds light on the struggles, resilience, and courage of 33 young girls who survived such horrific attacks. The movie portrays their journey from trauma to empowerment, highlighting their fight for justice and societal acceptance."
Crossing Borders,Drama,Three lives get entangled in Catch 22 situations as they illegally enter into a country to smuggle goods for their livelihood.
Saili,"Drama, Romance",The movie is based on the true story of the Nepali worker in the middle east who are compelled to be away from their families.
Dokh,Drama,"After a few no-gooders from Salley village beat up a boy from a neighbouring village, a long-running feud over a contested forest flares up. With the insurgency at its peak, the rebel commander suggests this dispute be settled through a game of football. In the midst of all this tension a new teacher is appointed to the village school. Will this versatile stranger provide a solution or cause even more trouble?"
Bhuthan: The World’s Happiest Man,Drama,"Bhutan: The World’s Happiest Man tells the story of Mr. Bishnu, an aging Bhutanese-American in Ohio, who dreams of returning to his homeland. After his unexpected death, his family faces a conflict over his final resting place, torn between past memories and present realities. This emotional drama explores themes of love, loss, and the search for belonging."
Devwani,Action,A private college owner seeks revenge on a student after the student refuses to study at his college.
Mitini,"Romance, Drama, Action",Best friends' journey from childhood to marriage.
Mansarra,Drama,"Mansarra is a specific species of rice. According to legend, it doesn't sprout alone; its seeds are typically mixed with other rice species before planting. A couple’s marriage is tested by fertility issues and by the husband’s growing bond with a single mother and her son."
Krishna Leela,"Drama, Romance, Crime",Krishna Leela is about difficulties faced by two souls while creating magic in love.
TAI CHUP MAI CHUP,Comedy,"""Tai Chup, Mai Chup” is more than just a stand-up special – it’s Apoorwa taking one of the toughest chapters of his life and flipping it into comedy. From the viral clip that shook the internet, to facing backlash from the Newar community, to spending nights in custody and paying fines, he walks us through it all. The pain, the silence, the lessons – retold with humor only he can bring."
Jerry On Top,"Drama, Romance","Jerry, the only son of famous business tycoon, Vijay; is never truly acknowledged and trusted prejudicing him far lack of matureness— is engaged to Shreya.  However, one day he comes up with an idea of summitting the Everest, unaware of the problems coming to his family and his love-life."
Hostel 3,Drama,"The film follows the lives of teenagers living in a hostel, capturing their fun, struggles, and personal growth. The story revolves around a group of students navigating their way through school life, friendships, and challenges."
Jai Ho,"Drama, Comedy","A compelling & emotional story about Sajina's journey of self-discovery and finding love & care with Jay. The conflict with her past and the rivalry between Jay & her ex-boyfriend, Ashok, adds tension to the plot. It will be interesting to see how Sajina navigates her choices and decides between her past life and her new friends. The story seems to explore themes of love, friendship & personal growth."
Jwai Saab,"Drama, Comedy","Disheartened by his home life, Gobardhan's fate takes a turn when he hears an advertisement on the radio offering the chance to become a live-in son-in-law. After winning several competitions with great effort, Gobardhan finally succeeds in becoming a live-in son-in-law. However, his life changes when his relationship with his wife takes a new turn."
216777,"Comedy, Horror","Madan Krishna Shrestha buys and wins a house in a lottery which he purchased from the one rupee coin that Hari Bansha Acharya dropped, just to find out later that the house is haunted. The epic episode most Nepalese remember for the haunting cover of ""Ghas Kaatne Khurkera"" by Hari Bansha Acharya."
Rose,Crime,"The plot follows the story of an airline pilot, Avi, and his deeply tangled romantic life with Rose, a beauty queen. When a mysterious murder and dark truths come to light, the film turns into a violent and unpredictable psychological thriller, where Avi's lawyer desperately navigates the justice system to uncover who is truly guilty."
Prem Geet 2,"Drama, Romance","Prem Geet 2, tells the story of Prem and Geet, its two protagonists, and their journey from Burma to Martha, a rural village in Mugu, Nepal."
Acharya,"History, Music","The inspiring, yet tragic life story of legendary Nepali singer Bhakta Raj Acharya."
Mirmire,,"In a remote Himalayan village, Nima's father tells everyone her mother works abroad, a daily lie to shield his daughter from a painful truth buried in village gossip. As whispers intensify, he fights to preserve Nima's smile."
Thamel Dot Com,Drama,One cool guy's life.
